{
  "$schema": "http://json-schema.org/draft-07/schema#",
  "$id": "https://earnie.local/tariffs.schema.json",
  "title": "Earnie Stromtarife",
  "type": "object",
  "properties": {
    "catalog_as_of": {
      "type": "string",
      "description": "Stand/Datum der Tarifliste (z. B. 2026 oder 2026-03-01)."
    },
    "import_tariffs": {
      "type": "array",
      "items": {
        "$ref": "#/definitions/import_tariff"
      }
    },
    "export_tariffs": {
      "type": "array",
      "items": {
        "$ref": "#/definitions/export_tariff"
      }
    },
    "oemag_monthly_feed_in_rates": {
      "$ref": "#/definitions/monthly_rates",
      "description": "OeMAG Gesetzlicher Marktpreis (Referenz für monthly_float): genau 12 Monate Cent/kWh netto.",
      "minItems": 12,
      "maxItems": 12
    },
    "monthly_float_reference_cent_kwh": {
      "type": "number",
      "exclusiveMinimum": 0,
      "description": "OeMAG arbeitspreis_kwh_cent als Nenner für monthly_float-Skalierung (z. B. 7.15)."
    },
    "earnie_data_model": {
      "type": "integer",
      "const": 2,
      "description": "Earnie data-model version for config pack import/export."
    }
  },
  "definitions": {
    "dach_common": {
      "type": "object",
      "properties": {
        "land": {
          "type": "string",
          "enum": [
            "AT",
            "DE",
            "CH"
          ]
        },
        "currency": {
          "type": "string",
          "enum": [
            "EUR",
            "CHF"
          ]
        },
        "settlement_fee_cent_kwh": {
          "type": "number",
          "minimum": 0
        },
        "markup_percent": {
          "type": "number"
        },
        "prices_include_vat": {
          "type": "boolean"
        },
        "vat_percent": {
          "type": "number",
          "minimum": 0
        },
        "netzentgelt_cent_kwh": {
          "type": "number",
          "minimum": 0
        },
        "notes": {
          "type": "string"
        }
      }
    },
    "monthly_rates": {
      "type": "array",
      "items": {
        "type": "object",
        "required": [
          "year",
          "month",
          "tariff_cent_kwh"
        ],
        "properties": {
          "year": {
            "type": "integer"
          },
          "month": {
            "type": "integer",
            "minimum": 1,
            "maximum": 12
          },
          "tariff_cent_kwh": {
            "type": "number",
            "exclusiveMinimum": 0
          }
        }
      }
    },
    "awattar_import_pricing": {
      "type": "object",
      "description": "aWATTar-Bezugsaufschläge pro Tarif (1.26.0 — statt globalem config.json awattar-Block).",
      "properties": {
        "fix_aufschlag_cent": {
          "type": "number",
          "description": "Fixer Aufschlag Cent/kWh auf EPEX (Netz, Gebühren)."
        },
        "netzverlust_faktor": {
          "type": "number",
          "exclusiveMinimum": 0,
          "description": "Multiplikator für Netzverluste auf den Marktpreis."
        },
        "mwst_austria_faktor": {
          "type": "number",
          "exclusiveMinimum": 0,
          "description": "USt-Faktor auf den Bezugspreis (z. B. 1.2)."
        }
      }
    },
    "awattar_export_pricing": {
      "type": "object",
      "description": "Dynamische Einspeise (dynamic_epex) — Gebühren pro Tarif.",
      "properties": {
        "feed_in_fee_factor": {
          "type": "number",
          "minimum": 0,
          "description": "Bearbeitungsgebühr auf |EPEX| (z. B. 0.19)."
        },
        "feed_in_fix_cent": {
          "type": "number",
          "description": "Fixer Cent/kWh-Offset auf die dynamische Einspeisevergütung."
        }
      }
    },
    "import_tariff": {
      "allOf": [
        {
          "$ref": "#/definitions/dach_common"
        },
        {
          "type": "object",
          "required": [
            "id",
            "type"
          ],
          "properties": {
            "id": {
              "type": "string"
            },
            "label": {
              "type": "string"
            },
            "type": {
              "enum": [
                "awattar",
                "fixed_cent",
                "spot_hourly",
                "ex_post_spot",
                "monthly_market",
                "monthly_table"
              ]
            },
            "fix_cent_kwh": {
              "type": "number",
              "exclusiveMinimum": 0
            },
            "monthly_rates": {
              "$ref": "#/definitions/monthly_rates"
            },
            "fix_aufschlag_cent": {
              "type": "number"
            },
            "netzverlust_faktor": {
              "type": "number",
              "exclusiveMinimum": 0
            },
            "mwst_austria_faktor": {
              "type": "number",
              "exclusiveMinimum": 0
            }
          }
        }
      ]
    },
    "export_tariff": {
      "allOf": [
        {
          "$ref": "#/definitions/dach_common"
        },
        {
          "type": "object",
          "required": [
            "id",
            "type"
          ],
          "properties": {
            "id": {
              "type": "string"
            },
            "label": {
              "type": "string"
            },
            "type": {
              "enum": [
                "fixed",
                "monthly_table",
                "monthly_float",
                "dynamic_epex",
                "spot_hourly",
                "ex_post_spot"
              ]
            },
            "k_push_cent": {
              "type": "number"
            },
            "arbeitspreis_kwh_cent": {
              "type": "number",
              "exclusiveMinimum": 0,
              "description": "Referenz-Arbeitspreis für monthly_float-Skalierung (Cent/kWh)."
            },
            "monthly_rates": {
              "$ref": "#/definitions/monthly_rates"
            },
            "feed_in_fee_factor": {
              "type": "number",
              "minimum": 0
            },
            "feed_in_fix_cent": {
              "type": "number"
            }
          }
        }
      ]
    }
  }
}
