{
    "$schema": "./tariffs.schema.json",
    "earnie_data_model": 2,
    "oemag_monthly_feed_in_rates": [
        {
            "year": 2025,
            "month": 7,
            "tariff_cent_kwh": 5.965
        },
        {
            "year": 2025,
            "month": 8,
            "tariff_cent_kwh": 5.9
        },
        {
            "year": 2025,
            "month": 9,
            "tariff_cent_kwh": 7.1
        },
        {
            "year": 2025,
            "month": 10,
            "tariff_cent_kwh": 9.008
        },
        {
            "year": 2025,
            "month": 11,
            "tariff_cent_kwh": 8.7
        },
        {
            "year": 2025,
            "month": 12,
            "tariff_cent_kwh": 8.7
        },
        {
            "year": 2026,
            "month": 1,
            "tariff_cent_kwh": 8.842
        },
        {
            "year": 2026,
            "month": 2,
            "tariff_cent_kwh": 8.457
        },
        {
            "year": 2026,
            "month": 3,
            "tariff_cent_kwh": 5.72
        },
        {
            "year": 2026,
            "month": 4,
            "tariff_cent_kwh": 6.772
        },
        {
            "year": 2026,
            "month": 5,
            "tariff_cent_kwh": 6.772
        },
        {
            "year": 2026,
            "month": 6,
            "tariff_cent_kwh": 6.772
        }
    ],
    "monthly_float_reference_cent_kwh": 7.15,
    "import_tariffs": [],
    "export_tariffs": []
}
